[{"title":"Capacitor announcements at Ioniconf 2020","authorName":"Max Lynch","authorEmail":"max@ionic.io","slug":"capacitor-announcements-at-ioniconf-2020","date":"2020-06-24T08:00:00.000Z","contents":"---\ntitle: Capacitor announcements at Ioniconf 2020\ndate: 2020-06-24 08:00:00\nauthor: Max Lynch <max@ionic.io>\n---\n\nToday at the first ever official Ioniconf, we unveiled a number of exciting updates to Capacitor and the Capacitor community.\n\nIn no particular order, we announced:\n\n- Capacitor will be opening up to embrace every modern web app technology and ecosystem. That means expect to see a lot more Capacitor apps running Angular Material, Tailwind, Material UI, and even Bootstrap.\n- A new [Capacitor Community](https://github.com/capacitor-community) GitHub org and NPM scope to curate the best community-supported Capacitor plugins and encourage more developers to build plugins.\n- Capacitor Elements, an upcoming project to bring operating-system level UI experiences to every Capacitor app, regardless of the web framework or UI library an app uses (powered by Ionic Framework under the hood).\n- We've updated the Capacitor site, moved to a new domain ([capacitorjs.com](https://capacitorjs.com)) and a new Twitter handle ([capacitorjs](https://capacitorjs)).\n\nCapacitor is quickly becoming the focal point of Ionic's open source offering, and we're investing heavily in it. Stay tuned for a ton more Capacitor updates in the coming months!\n","html":"<p>Today at the first ever official Ioniconf, we unveiled a number of exciting updates to Capacitor and the Capacitor community.</p>\n<p>In no particular order, we announced:</p>\n<ul>\n<li>Capacitor will be opening up to embrace every modern web app technology and ecosystem. That means expect to see a lot more Capacitor apps running Angular Material, Tailwind, Material UI, and even Bootstrap.</li>\n<li>A new <a href=\"https://github.com/capacitor-community\">Capacitor Community</a> GitHub org and NPM scope to curate the best community-supported Capacitor plugins and encourage more developers to build plugins.</li>\n<li>Capacitor Elements, an upcoming project to bring operating-system level UI experiences to every Capacitor app, regardless of the web framework or UI library an app uses (powered by Ionic Framework under the hood).</li>\n<li>We&#39;ve updated the Capacitor site, moved to a new domain (<a href=\"https://capacitorjs.com\">capacitorjs.com</a>) and a new Twitter handle (<a href=\"https://capacitorjs\">capacitorjs</a>).</li>\n</ul>\n<p>Capacitor is quickly becoming the focal point of Ionic&#39;s open source offering, and we&#39;re investing heavily in it. Stay tuned for a ton more Capacitor updates in the coming months!</p>\n","meta":{"title":"Capacitor announcements at Ioniconf 2020","date":"2020-06-24T08:00:00.000Z","author":"Max Lynch <max@ionic.io>"}},{"title":"Announcing Capacitor 2.0","authorName":"Max Lynch","authorEmail":"max@ionic.io","slug":"announcing-capacitor-2-0","date":"2020-04-08T08:00:00.000Z","contents":"---\ntitle: Announcing Capacitor 2.0\ndate: 2020-04-08 08:00:00\nauthor: Max Lynch <max@ionic.io>\n---\n\nToday we are excited to announce Capacitor 2.0!\n\nCapacitor 2.0 offers some key platform updates as well as security and bug fixes. These include:\n\n * Swift 5 and Xcode 11+ support\n * Android 10 (SDK 29) and AndroidX support\n * Bug fixes and usability improvements to 23+ core plugins\n * Support for generating splash screens and icons\n\nWe documented the whole update and talked about what's next for Capacitor over on the Ionic blog.\n\nCheck it out:\n\n[https://ionicframework.com/blog/announcing-capacitor-2-0/](https://ionicframework.com/blog/announcing-capacitor-2-0/)","html":"<p>Today we are excited to announce Capacitor 2.0!</p>\n<p>Capacitor 2.0 offers some key platform updates as well as security and bug fixes. These include:</p>\n<ul>\n<li>Swift 5 and Xcode 11+ support</li>\n<li>Android 10 (SDK 29) and AndroidX support</li>\n<li>Bug fixes and usability improvements to 23+ core plugins</li>\n<li>Support for generating splash screens and icons</li>\n</ul>\n<p>We documented the whole update and talked about what&#39;s next for Capacitor over on the Ionic blog.</p>\n<p>Check it out:</p>\n<p><a href=\"https://ionicframework.com/blog/announcing-capacitor-2-0/\">https://ionicframework.com/blog/announcing-capacitor-2-0/</a></p>\n","meta":{"title":"Announcing Capacitor 2.0","date":"2020-04-08T08:00:00.000Z","author":"Max Lynch <max@ionic.io>"}},{"title":"Announcing Capacitor 1.0","authorName":"Max Lynch","authorEmail":"max@ionic.io","slug":"announcing-capacitor-1-0","date":"2019-05-22T08:00:00.000Z","contents":"---\ntitle: Announcing Capacitor 1.0\ndate: 2019-05-22 08:00:00\nauthor: Max Lynch <max@ionic.io>\n---\n\nToday I’m thrilled to announce the 1.0 release of [Capacitor](/), Ionic’s new Native API Container that makes it easy to build web apps that run on iOS, Android, and the web as Progressive Web Apps—with full access to native functionality on each platform.\n\nWe documented this momentous occasion over on the Ionic blog, complete with a comparison to Cordova and where Capacitor is headed from here.\n\nTake a look: [https://ionicframework.com/blog/announcing-capacitor-1-0/](https://ionicframework.com/blog/announcing-capacitor-1-0/).","html":"<p>Today I’m thrilled to announce the 1.0 release of <a href=\"/\">Capacitor</a>, Ionic’s new Native API Container that makes it easy to build web apps that run on iOS, Android, and the web as Progressive Web Apps—with full access to native functionality on each platform.</p>\n<p>We documented this momentous occasion over on the Ionic blog, complete with a comparison to Cordova and where Capacitor is headed from here.</p>\n<p>Take a look: <a href=\"https://ionicframework.com/blog/announcing-capacitor-1-0/\">https://ionicframework.com/blog/announcing-capacitor-1-0/</a>.</p>\n","meta":{"title":"Announcing Capacitor 1.0","date":"2019-05-22T08:00:00.000Z","author":"Max Lynch <max@ionic.io>"}}]